Preciso de ajuda;ajuda
Gostaria de saber mais sobre...;ajuda
Como funciona?;ajuda
Onde encontro informações sobre...?;ajuda
Estou com um problema;ajuda
Quero reclamar sobre...;ajuda
Preciso de suporte técnico;ajuda
Não estou conseguindo...;ajuda
Pode me ajudar com...?;ajuda
Gostaria de tirar uma dúvida;ajuda
Como posso resolver este problema?;ajuda
O que devo fazer em caso de...?;ajuda
Onde posso encontrar um tutorial sobre...?;ajuda
Preciso de ajuda urgente;ajuda
Meu [produto/serviço] não está funcionando;ajuda
Não sei como usar [produto/serviço];ajuda
Pode me dar algumas dicas sobre...?;ajuda
Gostaria de saber como...?;ajuda
Como faço para...?;ajuda
Qual o procedimento para...?;ajuda
O que significa...?;ajuda
Pode me explicar como...?;ajuda
Não entendi como...?;ajuda
Pode me mostrar um exemplo de...?;ajuda
Gostaria de uma demonstração de...?;ajuda
Como posso solucionar este erro?;ajuda
O que devo fazer se...?;ajuda
Quais são os passos para...?;ajuda
Pode me guiar através do processo de...?;ajuda
Preciso de ajuda para configurar [produto/serviço];ajuda
Não sei como instalar [produto/serviço];ajuda
Pode me ajudar a encontrar [informação/recurso]?;ajuda
Onde posso baixar [arquivo/software]?;ajuda
Como posso entrar em contato com o suporte técnico?;ajuda
Qual o telefone de contato para ajuda?;ajuda
Preciso de ajuda com a minha conta;ajuda
Não consigo acessar minha conta;ajuda
Esqueci minha senha;ajuda
Como posso recuperar minha senha?;ajuda
Meu login não está funcionando;ajuda
Pode me ajudar a cancelar minha assinatura?;ajuda
Gostaria de saber como alterar meus dados cadastrais;ajuda
Como posso atualizar meu perfil?;ajuda
Preciso de ajuda com o pagamento;ajuda
Não consigo efetuar o pagamento;ajuda
Meu pagamento foi recusado;ajuda
Como posso solicitar um reembolso?;ajuda
Gostaria de saber como funciona o sistema de pagamento;ajuda
Quais são as formas de pagamento aceitas?;ajuda
Preciso de ajuda com um pedido;ajuda
Meu pedido não chegou;ajuda
Gostaria de saber o status do meu pedido;ajuda
Como posso rastrear meu pedido?;ajuda
Preciso de ajuda para trocar um produto;ajuda
Não gostei do produto;ajuda
Como posso devolver um produto?;ajuda
Gostaria de saber a política de troca e devolução;ajuda
Preciso de ajuda com um problema técnico;ajuda
Meu computador não está funcionando;ajuda
Meu celular está travando;ajuda
A internet não está funcionando;ajuda
Não consigo conectar à internet;ajuda
Preciso de ajuda com um software;ajuda
Não sei como usar este programa;ajuda
Pode me ajudar a instalar este programa?;ajuda
Preciso de ajuda com um jogo;ajuda
Não sei como jogar este jogo;ajuda
Pode me dar algumas dicas para jogar este jogo?;ajuda
Preciso de ajuda com um problema de saúde;ajuda
Estou com dor de cabeça;ajuda
Estou com febre;ajuda
Estou com gripe;ajuda
Preciso de ajuda médica urgente;ajuda
Não sei o que fazer;ajuda
Estou desesperado(a);ajuda
Preciso de ajuda psicológica;ajuda
Estou me sentindo sozinho(a);ajuda
Estou com medo;ajuda
Estou ansioso(a);ajuda
Preciso de ajuda para lidar com o estresse;ajuda
Não sei como controlar minhas emoções;ajuda
Preciso de ajuda para tomar uma decisão;ajuda
Estou indeciso(a);ajuda
Não sei qual caminho seguir;ajuda
Preciso de ajuda para alcançar meus objetivos;ajuda
Não sei como realizar meus sonhos;ajuda
Preciso de ajuda para ser feliz;ajuda
Não sei como encontrar a felicidade;ajuda
Estou perdido(a);ajuda
Não sei quem eu sou;ajuda
Não sei qual o meu propósito na vida;ajuda
Preciso de ajuda para me encontrar;ajuda
Preciso de ajuda para me aceitar;ajuda
Preciso de ajuda para me amar;ajuda
